{
  "$schema": "./design-tokens.schema.json",
  "lightToken": {
    "colorPrimaryBg": "rgba(132, 122, 255, 0.08)",
    "colorPrimaryBgActive": "rgba(132, 122, 255, 0.24)",
    "colorPrimaryBorder": "rgba(132, 122, 255, 0.36)",
    "colorSecondaryBorder": "rgba(132, 122, 255, 0.48)",
    "colorPrimary": "#847AFF",
    "colorPrimaryHover": "#9D95FF",
    "colorPrimaryActive": "#6A62CC",
    "colorBgBase": "#F9F9F9",
    "colorBgLayout": "#FFFFFF",
    "colorBgContainer": "#F9F9F9",
    "colorBgMask": "rgba(0, 0, 0, 0.45)",
    "colorTextBase": "rgba(0, 0, 0, 0.87)",
    "colorText": "rgba(0, 0, 0, 0.77)",
    "colorTextSecondary": "rgba(0, 0, 0, 0.58)",
    "colorTextTertiary": "rgba(0, 0, 0, 0.39)",
    "colorTextQuaternary": "rgba(0, 0, 0, 0.29)",
    "colorTextWhite": "#FFFFFF",
    "colorBorder": "#E0E0E0",
    "colorBorderSecondary": "#EBEBEB",
    "colorBorderTertiary": "#F5F5F5",
    "colorFill": "rgba(0, 0, 0, 0.08)",
    "colorFillSecondary": "rgba(0, 0, 0, 0.06)",
    "colorFillTertiary": "rgba(0, 0, 0, 0.04)",
    "colorFillQuaternary": "rgba(0, 0, 0, 0.02)",
    "colorInfo": "#1F82FC",
    "colorInfoHover": "rgba(31, 130, 252, 0.8)",
    "colorInfoBg": "rgba(31, 130, 252, 0.08)",
    "colorInfoBorder": "rgba(31, 130, 252, 0.24)",
    "colorInfoActive": "#015AC8",
    "colorSuccess": "#24C700",
    "colorSuccessHover": "rgba(36, 199, 0, 0.8)",
    "colorSuccessBg": "rgba(36, 199, 0, 0.08)",
    "colorSuccessBorder": "rgba(36, 199, 0, 0.24)",
    "colorSuccessActive": "#1B9600",
    "colorWarning": "#FFA700",
    "colorWarningHover": "rgba(255, 167, 0, 0.8)",
    "colorWarningBg": "rgba(255, 167, 0, 0.08)",
    "colorWarningBorder": "rgba(255, 167, 0, 0.24)",
    "colorWarningActive": "#CA8000",
    "colorError": "#EE3240",
    "colorErrorHover": "rgba(238, 50, 64, 0.8)",
    "colorErrorBg": "rgba(238, 50, 64, 0.08)",
    "colorErrorBorder": "rgba(238, 50, 64, 0.24)",
    "colorErrorActive": "#BE1C28",
    "colorLink": "#847AFF",
    "colorLinkHover": "rgba(132, 122, 255, 0.8)",
    "colorLinkActive": "#6A62CC",
    "boxShadow": "0 6px 16px 0 rgba(0, 0, 0, 0.08)",
    "boxShadowSecondary": "0 9px 8px 8px rgba(0, 0, 0, 0.05)"
  },
  "darkToken": {
    "colorPrimaryBg": "rgba(132, 122, 255, 0.12)",
    "colorPrimaryBgActive": "rgba(132, 122, 255, 0.24)",
    "colorPrimaryBorder": "rgba(132, 122, 255, 0.8)",
    "colorSecondaryBorder": "rgba(132, 122, 255, 0.48)",
    "colorPrimary": "#847AFF",
    "colorPrimaryHover": "#9D95FF",
    "colorPrimaryActive": "#6A62CC",
    "colorBgBase": "#222222",
    "colorBgLayout": "#111111",
    "colorBgContainer": "rgba(255, 255, 255, 0.08)",
    "colorBgMask": "rgba(0, 0, 0, 0.45)",
    "colorTextBase": "rgba(255, 255, 255, 0.9)",
    "colorText": "rgba(255, 255, 255, 0.8)",
    "colorTextSecondary": "rgba(255, 255, 255, 0.6)",
    "colorTextTertiary": "rgba(255, 255, 255, 0.4)",
    "colorTextQuaternary": "rgba(255, 255, 255, 0.3)",
    "colorTextWhite": "#FFFFFF",
    "colorBorder": "#4D4D4D",
    "colorBorderSecondary": "#3D3D3D",
    "colorBorderTertiary": "#292929",
    "colorFill": "rgba(255, 255, 255, 0.2)",
    "colorFillSecondary": "rgba(255, 255, 255, 0.12)",
    "colorFillTertiary": "rgba(255, 255, 255, 0.06)",
    "colorFillQuaternary": "rgba(255, 255, 255, 0.04)",
    "colorInfo": "#1F82FC",
    "colorInfoHover": "rgba(31, 130, 252, 0.8)",
    "colorInfoBg": "rgba(31, 130, 252, 0.12)",
    "colorInfoBorder": "rgba(31, 130, 252, 0.4)",
    "colorInfoActive": "rgba(31, 130, 252, 0.6)",
    "colorSuccess": "#65C80B",
    "colorSuccessHover": "rgba(101, 200, 11, 0.89)",
    "colorSuccessBg": "rgba(101, 200, 11, 0.12)",
    "colorSuccessBorder": "rgba(101, 200, 11, 0.4)",
    "colorSuccessActive": "rgba(101, 200, 11, 0.6)",
    "colorWarning": "#F2A30D",
    "colorWarningHover": "rgba(227, 61, 73, 0.8)",
    "colorWarningBg": "rgba(227, 61, 73, 0.12)",
    "colorWarningBorder": "rgba(227, 61, 73, 0.4)",
    "colorWarningActive": "rgba(227, 61, 73, 0.6)",
    "colorError": "#EE3240",
    "colorErrorHover": "rgba(238, 50, 64, 0.8)",
    "colorErrorBg": "rgba(238, 50, 64, 0.12)",
    "colorErrorBorder": "rgba(238, 50, 64, 0.4)",
    "colorErrorActive": "rgba(238, 50, 64, 0.6)",
    "colorLink": "#847AFF",
    "colorLinkHover": "rgba(132, 122, 255, 0.8)",
    "colorLinkActive": "rgba(132, 122, 255, 0.6)",
    "boxShadow": "0 6px 16px 0 rgba(0, 0, 0, 0.08)",
    "boxShadowSecondary": "0 9px 8px 8px rgba(0, 0, 0, 0.05)"
  },
  "borderRadius": {
    "borderRadiusXS": 2,
    "borderRadiusSM": 4,
    "borderRadius": 6,
    "borderRadiusLG": 8
  },
  "padding": {
    "paddingXXS": 4,
    "paddingXS": 8,
    "paddingSM": 12,
    "padding": 16,
    "paddingMD": 20,
    "paddingLG": 24,
    "paddingXL": 32
  },
  "margin": {
    "marginXXS": 4,
    "marginXS": 8,
    "marginSM": 12,
    "margin": 16,
    "marginMD": 20,
    "marginLG": 24,
    "marginXL": 32
  },
  "fontSize": {
    "fontSizeXS": 11,
    "fontSizeSM": 12,
    "fontSizeS": 13,
    "fontSize": 14,
    "fontSizeLG": 16,
    "fontSizeXL": 29
  },
  "heading": {
    "heading5": 16,
    "heading4": 20,
    "heading3": 24,
    "heading2": 30,
    "heading1": 38
  }
}
